Acionamento,Deslocamento,Estabelecimento da viatura,Silencio,Aproximacao,Iniciar comunicacao,Apresentacao,Desenvolvimento de Vinculo/Confianca,Observar gatilhos e ancoras,Tecnica: Parafrase,Tecnica: Ponte,Tecnica: Sucesso anterior,Tecnica: Outdoor,Convencimento,Sucesso na abordagem tecnica,Insucesso em todas as tentativas de abordagem tecnica
Coletar o maximo de informacoes possiveis (CIOSP/COB),"Minimo 6 profissionais (comandante, abordador tecnico, abordadores taticos, isoladores e bombeiros de reserva)",Chegar o mais discreto possivel,Silencio Inicial,Aproximar-se cautelosamente,Identificar-se,Atentar-se para a linguagem nao-verbal,Estabelecer vinculo de confianca,Identificar fatores de protecao e de risco,Observar o motivo que leva a vitima a tentar suicidio,Observar o motivo que leva a vitima a tentar suicidio,Observar o motivo que leva a vitima a tentar suicidio,Observar o motivo que leva a vitima a tentar suicidio,Comunicacao nao-violenta,Acolhimento da vitima,Utilizar abordagem tatica
Verificar acionamento de outras instituicoes,"Codigo 3 (desligar giroflex e sirenes quando proximo ao local de atendimento, para nao estressar mais a vitima)","Estacionar em local seguro e, se possivel, em local que sirva de ancoragem para os bombeiros em casos de tentativas por precipitacao em pontes",Zona de aproximacao (quente),Sempre de frente com a vitima,Perguntar nome,Dizer a vitima que voce esta ali para escuta-la,"Perguntar se a vitima trabalha, se tem filhos, etc",Focar nas ancoras,Ajudar o(a) tentante parafraseando suas proprias palavras,Direcionar peguntas perigosas para um local seguro,Dialogar com o tentante para que reflita nas suas proprias capacidades e possibilidades,Tentar retirar a monoideia de tirar sua propria vida,Tentar trazer a vitima a ambivalencia,Encaminhar ao hospital,Acolhimento da vitima
Acionamento da GU o mais rapido,"Identificar antecipadamente o local (fluxo, bloqueio de vias) ","Em transito intenso, parar visando a protecao da abordagem, utilizando-se cones","Aguardar vitima terminar sua fala (verborreia, xingamentos)",Parar caso a vitima peca para nao se aproximar,Estabelecer seguranca (ancoragem),Iniciar o dialogo,Observar as caracteristicas psicopatologicas da vitima,Utilizar a empatia,"Cuidado com as disgressoes, utilizando ideias beneficas e oportunas","Garantir fatores gerais, como permanecer vivo e propor outra alternativa",Utilizar de momentos anteriores de sua vida para convence-lo(a) a continuar vivo,Convencer a vitima do que e mais importante para o momento: a vida,Trocar menos por mais,Continuidade ao atendimento,Encaminhar ao hospital
"Em pontes, acionar instituicao responsavel pelo transito",,,,,,,,,,,,,,,
"Em torres de alta tensao, acionar empresa de eletricidade",,,,,,,,,,,,,,,
"Ocorrencia com incendiarios, participacao de equipe de combate a incendio do CBM",,,,,,,,,,,,,,,
"Ocorrencia com arma branca/ vitima agressiva, acionar a PM",,,,,,,,,,,,,,,